{
  "$schema": "https://json-schema.org/draft/2020-12/schema",
  "$id": "https://airoot.local/schema/broker-response-v1.json",
  "title": "AIROOT Protected Broker Response",
  "type": "object",
  "additionalProperties": false,
  "required": ["schema_version", "request_id", "status", "security_mode", "enforcement", "transaction_id", "state", "reason_code", "evidence"],
  "properties": {
    "schema_version": { "$ref": "common.schema.json#/$defs/schemaVersion" },
    "request_id": { "$ref": "common.schema.json#/$defs/id" },
    "status": { "type": "string", "enum": ["ok", "rejected", "failed", "recovery_required"] },
    "security_mode": { "$ref": "common.schema.json#/$defs/securityMode" },
    "enforcement": { "$ref": "common.schema.json#/$defs/enforcement" },
    "transaction_id": { "type": ["string", "null"] },
    "state": { "type": ["string", "null"] },
    "reason_code": { "type": ["string", "null"], "pattern": "^[A-Z][A-Z0-9_]{2,63}$" },
    "evidence": { "type": "array", "items": { "$ref": "common.schema.json#/$defs/evidence" } },
    "retryable": { "type": "boolean" }
  }
}
