{
  "enforcement": "same_user_can_bypass",
  "evidence": [
    {
      "detail": "commit_plan is refused by the user compatibility mode's server: a commit writes Zone R and moves the active binding at ACTIVE_BOUND \u2014 the pipe is real but the process behind it is not a protected one, and a same-user server that changed a binding would be claiming an authority its own DACL does not give it (decided: ADR-0025 leaves the elevated broker to P2)",
      "kind": "reason"
    },
    {
      "detail": "operation: commit_plan",
      "kind": "evidence"
    },
    {
      "detail": "security_mode: policy_only, enforcement: same_user_can_bypass \u2014 this pipe is served by a same-user process, so nothing here could enforce what the operation needs",
      "kind": "evidence"
    },
    {
      "detail": "why this operation is not honoured: a commit writes Zone R and moves the active binding at ACTIVE_BOUND \u2014 the pipe is real but the process behind it is not a protected one, and a same-user server that changed a binding would be claiming an authority its own DACL does not give it",
      "kind": "evidence"
    },
    {
      "detail": "ADR-0025 (D1) keeps the elevated broker out of this build; the approval signer is not what this waits for (ADR-0046 made it a local, explicit step)",
      "kind": "evidence"
    },
    {
      "detail": "adr=ADR-0025",
      "kind": "detail"
    },
    {
      "detail": "operation=commit_plan",
      "kind": "detail"
    }
  ],
  "reason_code": "NOT_IMPLEMENTED",
  "request_id": "req/broker/pipe-commit-0001",
  "retryable": false,
  "schema_version": 1,
  "security_mode": "policy_only",
  "state": null,
  "status": "rejected",
  "transaction_id": null
}
